{
  "metadata": {
    "datasetId": "satpam-week1-seed-v1",
    "version": "0.1.0-week1",
    "scope": "week_1_foundation",
    "createdAt": "2026-06-10T00:00:00+07:00",
    "simulationOnly": true,
    "dataPolicy": [
      "dummy_data_only",
      "safe_test_domains_only",
      "masked_payment_identifiers",
      "simulation_traffic_and_crawler_only",
      "human_verification_required"
    ]
  },
  "nodes": {
    "reports": [
      {
        "id": "report-judol-001",
        "type": "Report",
        "label": "Laporan Judol Alpha",
        "source": "dummy_user_report",
        "description": "Pelapor dummy melihat promo bonus slot dari akun demo, diarahkan ke https://bonus-alpha.test/promo, lalu diminta kontak WA +62-812-0000-1101 dan transfer ke rekening dummy 1234****9001.",
        "categoryHint": "judol",
        "status": "new",
        "confidence": "medium",
        "riskScore": 0,
        "riskLevel": "low",
        "verificationStatus": "unreviewed",
        "createdAt": "2026-06-10T08:00:00+07:00",
        "updatedAt": "2026-06-10T08:00:00+07:00"
      },
      {
        "id": "report-pinjol-001",
        "type": "Report",
        "label": "Laporan APK Pinjol Demo",
        "source": "dummy_user_report",
        "description": "Pelapor dummy menerima tawaran aplikasi DanaCepat Demo dari https://cepat-cair-demo.test/app dengan package id.demo.danacepat dan permintaan izin kontak serta SMS.",
        "categoryHint": "pinjol_illegal",
        "status": "new",
        "confidence": "medium",
        "riskScore": 0,
        "riskLevel": "low",
        "verificationStatus": "unreviewed",
        "createdAt": "2026-06-10T08:10:00+07:00",
        "updatedAt": "2026-06-10T08:10:00+07:00"
      },
      {
        "id": "report-cross-001",
        "type": "Report",
        "label": "Laporan Keterkaitan Judol Pinjol",
        "source": "dummy_user_report",
        "description": "Pelapor dummy menyebut nomor WA +62-812-0000-3303 yang sama mengirim promo situs https://promo-gabungan.test/landing dan tawaran APK SlotCash Pinjam.",
        "categoryHint": "cross_ecosystem",
        "status": "new",
        "confidence": "medium",
        "riskScore": 0,
        "riskLevel": "low",
        "verificationStatus": "unreviewed",
        "createdAt": "2026-06-10T08:20:00+07:00",
        "updatedAt": "2026-06-10T08:20:00+07:00"
      },
      {
        "id": "report-payment-001",
        "type": "Report",
        "label": "Laporan Aliran Dana Simulasi",
        "source": "dummy_user_report",
        "description": "Beberapa korban dummy melakukan transfer nominal kecil ke rekening Bank Dummy 1234****9003, lalu dana simulasi berpindah cepat ke e-wallet 0899****9003.",
        "categoryHint": "payment_flow",
        "status": "new",
        "confidence": "medium",
        "riskScore": 0,
        "riskLevel": "low",
        "verificationStatus": "unreviewed",
        "createdAt": "2026-06-10T08:30:00+07:00",
        "updatedAt": "2026-06-10T08:30:00+07:00"
      },
      {
        "id": "report-traffic-crawler-001",
        "type": "Report",
        "label": "Laporan Traffic dan Crawler Simulasi",
        "source": "dummy_internal_simulation",
        "description": "Traffic log simulasi menunjukkan lonjakan request ke promo-gabungan.test, dan crawler finding dummy menemukan redirect dari short-alpha.test ke domain tersebut.",
        "categoryHint": "traffic_crawler",
        "status": "new",
        "confidence": "medium",
        "riskScore": 0,
        "riskLevel": "low",
        "verificationStatus": "unreviewed",
        "createdAt": "2026-06-10T08:40:00+07:00",
        "updatedAt": "2026-06-10T08:40:00+07:00"
      },
      {
        "id": "report-benign-001",
        "type": "Report",
        "label": "Laporan Edukasi Finansial Benign",
        "source": "dummy_user_report",
        "description": "Pelapor dummy menemukan artikel edukasi finansial di https://edukasi-finansial.example/artikel yang membahas pinjaman legal secara umum tanpa ajakan transfer atau instal APK.",
        "categoryHint": "benign",
        "status": "new",
        "confidence": "medium",
        "riskScore": 0,
        "riskLevel": "low",
        "verificationStatus": "unreviewed",
        "createdAt": "2026-06-10T08:50:00+07:00",
        "updatedAt": "2026-06-10T08:50:00+07:00"
      }
    ],
    "victims": [
      {
        "id": "victim-001",
        "type": "Victim",
        "label": "Pelapor Demo A",
        "source": "dummy_user_report",
        "alias": "Pelapor Demo A",
        "riskExposureLevel": "medium",
        "confidence": "medium",
        "riskScore": 0,
        "riskLevel": "low",
        "verificationStatus": "unreviewed",
        "createdAt": "2026-06-10T08:00:00+07:00"
      },
      {
        "id": "victim-002",
        "type": "Victim",
        "label": "Pelapor Demo B",
        "source": "dummy_user_report",
        "alias": "Pelapor Demo B",
        "riskExposureLevel": "high",
        "confidence": "medium",
        "riskScore": 0,
        "riskLevel": "low",
        "verificationStatus": "unreviewed",
        "createdAt": "2026-06-10T08:10:00+07:00"
      },
      {
        "id": "victim-003",
        "type": "Victim",
        "label": "Pelapor Demo C",
        "source": "dummy_user_report",
        "alias": "Pelapor Demo C",
        "riskExposureLevel": "high",
        "confidence": "medium",
        "riskScore": 0,
        "riskLevel": "low",
        "verificationStatus": "unreviewed",
        "createdAt": "2026-06-10T08:20:00+07:00"
      },
      {
        "id": "victim-004",
        "type": "Victim",
        "label": "Pelapor Demo D",
        "source": "dummy_user_report",
        "alias": "Pelapor Demo D",
        "riskExposureLevel": "medium",
        "confidence": "medium",
        "riskScore": 0,
        "riskLevel": "low",
        "verificationStatus": "unreviewed",
        "createdAt": "2026-06-10T08:30:00+07:00"
      },
      {
        "id": "victim-005",
        "type": "Victim",
        "label": "Pelapor Demo E",
        "source": "dummy_user_report",
        "alias": "Pelapor Demo E",
        "riskExposureLevel": "low",
        "confidence": "medium",
        "riskScore": 0,
        "riskLevel": "low",
        "verificationStatus": "unreviewed",
        "createdAt": "2026-06-10T08:50:00+07:00"
      }
    ],
    "urls": [
      {
        "id": "url-bonus-alpha-promo",
        "type": "URL",
        "label": "bonus-alpha.test/promo",
        "source": "dummy_user_report",
        "rawUrl": "https://bonus-alpha.test/promo",
        "normalizedUrl": "https://bonus-alpha.test/promo",
        "domain": "bonus-alpha.test",
        "firstSeenAt": "2026-06-10T08:00:00+07:00",
        "lastSeenAt": "2026-06-10T08:00:00+07:00",
        "confidence": "medium",
        "riskScore": 0,
        "riskLevel": "low",
        "verificationStatus": "unreviewed",
        "createdAt": "2026-06-10T08:00:00+07:00"
      },
      {
        "id": "url-cepat-cair-app",
        "type": "URL",
        "label": "cepat-cair-demo.test/app",
        "source": "dummy_user_report",
        "rawUrl": "https://cepat-cair-demo.test/app",
        "normalizedUrl": "https://cepat-cair-demo.test/app",
        "domain": "cepat-cair-demo.test",
        "firstSeenAt": "2026-06-10T08:10:00+07:00",
        "lastSeenAt": "2026-06-10T08:10:00+07:00",
        "confidence": "medium",
        "riskScore": 0,
        "riskLevel": "low",
        "verificationStatus": "unreviewed",
        "createdAt": "2026-06-10T08:10:00+07:00"
      },
      {
        "id": "url-promo-gabungan-landing",
        "type": "URL",
        "label": "promo-gabungan.test/landing",
        "source": "dummy_user_report",
        "rawUrl": "https://promo-gabungan.test/landing",
        "normalizedUrl": "https://promo-gabungan.test/landing",
        "domain": "promo-gabungan.test",
        "firstSeenAt": "2026-06-10T08:20:00+07:00",
        "lastSeenAt": "2026-06-10T08:40:00+07:00",
        "confidence": "medium",
        "riskScore": 0,
        "riskLevel": "low",
        "verificationStatus": "unreviewed",
        "createdAt": "2026-06-10T08:20:00+07:00"
      },
      {
        "id": "url-short-alpha-a1",
        "type": "URL",
        "label": "short-alpha.test/a1",
        "source": "crawler_simulation",
        "rawUrl": "https://short-alpha.test/a1",
        "normalizedUrl": "https://short-alpha.test/a1",
        "domain": "short-alpha.test",
        "firstSeenAt": "2026-06-10T08:40:00+07:00",
        "lastSeenAt": "2026-06-10T08:40:00+07:00",
        "confidence": "medium",
        "riskScore": 0,
        "riskLevel": "low",
        "verificationStatus": "unreviewed",
        "createdAt": "2026-06-10T08:40:00+07:00"
      },
      {
        "id": "url-edukasi-finansial-artikel",
        "type": "URL",
        "label": "edukasi-finansial.example/artikel",
        "source": "dummy_user_report",
        "rawUrl": "https://edukasi-finansial.example/artikel",
        "normalizedUrl": "https://edukasi-finansial.example/artikel",
        "domain": "edukasi-finansial.example",
        "firstSeenAt": "2026-06-10T08:50:00+07:00",
        "lastSeenAt": "2026-06-10T08:50:00+07:00",
        "confidence": "medium",
        "riskScore": 0,
        "riskLevel": "low",
        "verificationStatus": "unreviewed",
        "createdAt": "2026-06-10T08:50:00+07:00"
      }
    ],
    "domains": [
      {
        "id": "domain-bonus-alpha-test",
        "type": "Domain",
        "label": "bonus-alpha.test",
        "source": "dummy_user_report",
        "domainName": "bonus-alpha.test",
        "category": "judol_promo",
        "firstSeenAt": "2026-06-10T08:00:00+07:00",
        "lastSeenAt": "2026-06-10T08:00:00+07:00",
        "confidence": "medium",
        "riskScore": 0,
        "riskLevel": "low",
        "verificationStatus": "unreviewed",
        "createdAt": "2026-06-10T08:00:00+07:00"
      },
      {
        "id": "domain-cepat-cair-demo-test",
        "type": "Domain",